Project,Antipattern,File,Line from,Line to,Code fragment,Explanation
activej_activej,ID Required,examples/core/sql/src/main/java/advanced/jooq/model/tables/NewUsers.java,56,56,"public final TableField<NewUsersRecord, Integer> ID = createField(DSL.name(""id""), SQLDataType.INTEGER.nullable(false).identity(true), this, """");","The primary key column is generically named 'id' instead of a more descriptive name like 'user_id' or 'new_user_id'. Consider renaming the column to include the table name (e.g., 'new_user_id') to make joins more readable and avoid ambiguity when joining multiple tables."
activej_activej,ID Required,examples/core/sql/src/main/java/advanced/jooq/model/tables/Users.java,56,56,"public final TableField<UsersRecord, Integer> ID = createField(DSL.name(""id""), SQLDataType.INTEGER.nullable(false).identity(true), this, """");",The primary key column is generically named 'id' instead of a more descriptive name like 'user_id'. Consider renaming the column to 'user_id' to make it self-documenting and avoid ambiguity when joining tables.
activej_activej,Implicit Columns,examples/core/sql/src/main/java/advanced/JooqPooledSqlLauncher.java,48,48,context.select().from(USERS),"Using `select()` without specifying columns fetches all columns from the USERS table, which can lead to maintenance issues if the table schema changes. Explicitly list the required columns, e.g., `context.select(USERS.ID, USERS.NAME, ...).from(USERS)`."
activej_activej,Implicit Columns,examples/core/sql/src/main/java/advanced/JooqSqlLauncher.java,47,47,context.select().from(USERS),"Using `select()` without specifying columns fetches all columns from the USERS table, which can lead to maintenance issues if the table schema changes. Explicitly list the required columns, e.g., `context.select(USERS.ID, USERS.NAME, ...).from(USERS)`."
activej_activej,Implicit Columns,examples/core/sql/src/main/java/advanced/util/Utils.java,56,56,context.select().from(table).fetch(),"Using `select()` without specifying columns fetches all columns from the table, which can retrieve unnecessary data and cause performance issues. Specify only the required columns explicitly, e.g., `context.select(TABLE.COL1, TABLE.COL2).from(table).fetch()`."
