Project,Antipattern,File,Line from,Line to,Code fragment,Explanation
AlexzTj_p2p,Rounding Errors,src/main/generated/org/jooq/generated/public_/tables/Transaction.java,69,69,"public final TableField<TransactionRecord, Double> AMOUNT = createField(DSL.name(""AMOUNT""), org.jooq.impl.SQLDataType.DOUBLE, this, """");","The AMOUNT column uses DOUBLE type which can cause rounding errors when storing monetary values. Use DECIMAL or NUMERIC with appropriate precision and scale (e.g., DECIMAL(19,4)) to ensure accurate financial calculations."
AlexzTj_p2p,Rounding Errors,src/main/generated/org/jooq/generated/public_/tables/User.java,74,74,"public final TableField<UserRecord, Double> BALANCE = createField(DSL.name(""BALANCE""), org.jooq.impl.SQLDataType.DOUBLE, this, """");","The BALANCE column uses a DOUBLE type which can cause rounding errors when storing monetary values. Use DECIMAL or NUMERIC with appropriate precision and scale (e.g., DECIMAL(19,4)) to ensure accurate financial calculations."
AlexzTj_p2p,Implicit Columns,src/main/java/p2p/repository/TransactionRepository.java,30,30,DSL.using(connection).selectFrom(TRANSACTION),"Using selectFrom(TRANSACTION) fetches all columns from the TRANSACTION table, which may retrieve unnecessary data and reduce performance. Consider explicitly selecting only the required columns using select(TRANSACTION.ID, TRANSACTION.USER_ID, ...).from(TRANSACTION)."
AlexzTj_p2p,Implicit Columns,src/main/java/p2p/repository/TransactionRepository.java,37,37,DSL.using(connection).selectFrom(TRANSACTION).fetchInto(TransactionRecord.class),"Using selectFrom(TRANSACTION) fetches all columns from the TRANSACTION table, which may retrieve unnecessary data and reduce performance. Consider explicitly selecting only the required columns using select(TRANSACTION.ID, TRANSACTION.USER_ID, ...).from(TRANSACTION)."
AlexzTj_p2p,Implicit Columns,src/main/java/p2p/repository/UserRepository.java,19,19,UserRecord userRecord = DSL.using(connection).selectFrom(USER),"Using selectFrom(USER) fetches all columns from the USER table into a UserRecord, which may retrieve unnecessary data. Consider using select() with only the specific columns needed (ID, BALANCE, BIC, IBAN, NAME, PHONE)."
AlexzTj_p2p,Implicit Columns,src/main/java/p2p/repository/UserRepository.java,26,26,List<UserRecord> userRecords = DSL.using(connection).selectFrom(USER),"Using selectFrom(USER) fetches all columns from the USER table, potentially retrieving more data than needed. Consider using select() with explicit column names to improve query performance."
AlexzTj_p2p,Implicit Columns,src/main/java/p2p/repository/UserRepository.java,34,34,UserRecord userRecord = DSL.using(connection).selectFrom(USER),"Using selectFrom(USER) retrieves all columns from the USER table into a record. Consider explicitly selecting only the required columns (ID, BALANCE, BIC, IBAN, NAME, PHONE) to reduce data transfer."
