Project,Antipattern,File,Line from,Line to,Code fragment,Explanation
AnastasiaPleshkova_tnkf-tracker,ID Required,scrapper/src/main/java/edu/java/scrapper/domain/jooq/tables/Chat.java,65,66,"public final TableField<ChatRecord, Long> ID =
    createField(DSL.name(""ID""), SQLDataType.BIGINT.nullable(false).identity(true), this, """");",The table uses a generic 'ID' column as the primary key while having a natural unique identifier 'TG_CHAT_ID' (Telegram chat ID) that could serve as the primary key. Consider using 'TG_CHAT_ID' as the primary key or renaming 'ID' to something more descriptive like 'CHAT_ID'.
AnastasiaPleshkova_tnkf-tracker,ID Required,scrapper/src/main/java/edu/java/scrapper/domain/jooq/tables/Link.java,67,68,"public final TableField<LinkRecord, Long> ID =
    createField(DSL.name(""ID""), SQLDataType.BIGINT.nullable(false).identity(true), this, """");","The table uses a generic 'ID' column as primary key while having a unique constraint on 'URL' (CONSTRAINT_23), which is a natural key suitable as a primary key since URLs are immutable identifiers for links. Consider using 'URL' as the primary key or renaming the synthetic key to something more descriptive like 'link_id'."
AnastasiaPleshkova_tnkf-tracker,Implicit Columns,scrapper/src/main/java/edu/java/scrapper/repositories/jooq/JooqChatRepository.java,25,25,.selectFrom(Tables.CHAT),"Using selectFrom() fetches all columns from the CHAT table, which may retrieve unnecessary data and reduce performance. Consider using select() with only the specific columns needed for the Chat object."
AnastasiaPleshkova_tnkf-tracker,Implicit Columns,scrapper/src/main/java/edu/java/scrapper/repositories/jooq/JooqChatRepository.java,34,34,.selectFrom(Tables.CHAT),"Using selectFrom() fetches all columns from the CHAT table, which may retrieve unnecessary data and reduce performance. Consider using select() with only the specific columns needed for the Chat object."
AnastasiaPleshkova_tnkf-tracker,Implicit Columns,scrapper/src/main/java/edu/java/scrapper/repositories/jooq/JooqLinkRepository.java,26,26,return dslContext.selectFrom(Tables.LINK),"Using selectFrom() fetches all columns from the LINK table, which may retrieve unnecessary data and impact performance. Consider using select() with only the specific columns needed for the Link class."
AnastasiaPleshkova_tnkf-tracker,Implicit Columns,scrapper/src/main/java/edu/java/scrapper/repositories/jooq/JooqLinkRepository.java,34,34,return dslContext.selectFrom(Tables.LINK),"Using selectFrom() fetches all columns from the LINK table, which transfers unnecessary data when only specific fields are needed. Explicitly specify the required columns using select()."
AnastasiaPleshkova_tnkf-tracker,Implicit Columns,scrapper/src/main/java/edu/java/scrapper/repositories/jooq/JooqLinkRepository.java,41,41,return dslContext.select(),"Using select() without specifying columns fetches all columns from all joined tables (CHAT_LINK_MAPPING, LINK, CHAT), which is inefficient. Specify only the columns needed for the Link class."
AnastasiaPleshkova_tnkf-tracker,Implicit Columns,scrapper/src/main/java/edu/java/scrapper/repositories/jooq/JooqLinkRepository.java,52,52,return dslContext.select(),"Using select() without specifying columns fetches all columns from all joined tables, retrieving unnecessary data. Specify only the columns required for the Chat class."
AnastasiaPleshkova_tnkf-tracker,Implicit Columns,scrapper/src/main/java/edu/java/scrapper/repositories/jooq/JooqLinkRepository.java,63,63,return dslContext.selectFrom(Tables.LINK),Using selectFrom() fetches all columns from the LINK table when only specific fields may be needed. Consider explicitly listing the required columns using select().
