Project,Antipattern,File,Line from,Line to,Code fragment,Explanation
BuchnevDmitry_LinkTracker,Implicit Columns,scrapper/src/main/java/edu/java/scrapper/domain/jooq/impl/JooqChatRepository.java,51,51,return dslContext.selectFrom(CHAT),"Using `selectFrom(CHAT)` fetches all columns from the CHAT table, which may retrieve unnecessary data and reduce query performance. Replace with an explicit column selection like `select(CHAT.ID, CHAT.CREATED_AT, CHAT.CREATED_BY).from(CHAT)` to fetch only the required columns."
BuchnevDmitry_LinkTracker,Implicit Columns,scrapper/src/main/java/edu/java/scrapper/domain/jooq/impl/JooqLinkRepository.java,22,22,dslContext.selectFrom(LINK),"Using selectFrom(LINK) fetches all columns from the LINK table, which may retrieve unnecessary data and reduce performance. Consider explicitly selecting only the required columns using select(LINK.ID, LINK.URL, ...).from(LINK)."
BuchnevDmitry_LinkTracker,Implicit Columns,scrapper/src/main/java/edu/java/scrapper/domain/jooq/impl/JooqLinkRepository.java,47,47,dslContext.selectFrom(LINK),"Using selectFrom(LINK) fetches all columns from the LINK table, which may include columns not needed by the caller. Consider explicitly selecting only the columns required for the Link model."
BuchnevDmitry_LinkTracker,Implicit Columns,scrapper/src/main/java/edu/java/scrapper/domain/jooq/impl/JooqLinkRepository.java,85,85,dslContext.select(LINK.fields()),"Using LINK.fields() selects all columns from the LINK table, which is equivalent to SELECT *. Consider explicitly listing only the columns needed for the Link class."
BuchnevDmitry_LinkTracker,Implicit Columns,scrapper/src/main/java/edu/java/scrapper/domain/jooq/impl/JooqLinkRepository.java,94,94,dslContext.select(CHAT.fields()),"Using CHAT.fields() selects all columns from the CHAT table, which is equivalent to SELECT *. Consider explicitly listing only the columns needed for the Chat class."
BuchnevDmitry_LinkTracker,ID Required,scrapper/src/main/java/edu/java/scrapper/domain/jooq/tables/Chat.java,63,64,"public final TableField<ChatRecord, Long> ID =
    createField(DSL.name(""ID""), SQLDataType.BIGINT.nullable(false), this, """");",The primary key column is generically named 'ID' instead of a more descriptive name like 'chat_id'. Consider renaming the primary key to 'chat_id' to make it self-documenting and to avoid ambiguity when joining tables.
BuchnevDmitry_LinkTracker,ID Required,scrapper/src/main/java/edu/java/scrapper/domain/jooq/tables/Link.java,66,67,"public final TableField<LinkRecord, Long> ID =
    createField(DSL.name(""ID""), SQLDataType.BIGINT.nullable(false).identity(true), this, """");","The table uses a generic 'ID' column as the primary key, but there's already a unique constraint on the 'URL' column (CONSTRAINT_23) which could serve as a natural primary key since URLs are inherently unique identifiers for links. Consider using 'URL' as the primary key or renaming the synthetic key to something more descriptive like 'link_id'."
