Project,Antipattern,File,Line from,Line to,Code fragment,Explanation
DrBrother_notification-system,Implicit Columns,scrapper/src/main/java/ru/tinkoff/edu/java/scrapper/dao/jooq/JooqChatDAOImpl.java,42,42,return dslContext.select(CHAT),"Selecting the entire CHAT table record fetches all columns, even though only the ID column is used in the conversion method. Replace `select(CHAT)` with `select(CHAT.ID)` to explicitly fetch only the required column."
DrBrother_notification-system,Implicit Columns,scrapper/src/main/java/ru/tinkoff/edu/java/scrapper/dao/jooq/JooqLinkDAOImpl.java,51,51,dslContext.select(LINK),"Selecting the entire LINK table fetches all columns, which may retrieve unnecessary data and reduce query performance. Instead, explicitly select only the required columns: `dslContext.select(LINK.ID, LINK.URL, LINK.CHECKTIME, LINK.UPDATETIME)`."
DrBrother_notification-system,Implicit Columns,scrapper/src/main/java/ru/tinkoff/edu/java/scrapper/dao/jooq/JooqLinkDAOImpl.java,61,61,dslContext.select(LINK),"Selecting the entire LINK table fetches all columns, which may retrieve unnecessary data and reduce query performance. Instead, explicitly select only the required columns: `dslContext.select(LINK.ID, LINK.URL, LINK.CHECKTIME, LINK.UPDATETIME)`."
DrBrother_notification-system,Implicit Columns,scrapper/src/main/java/ru/tinkoff/edu/java/scrapper/dao/jooq/JooqLinkDAOImpl.java,72,72,dslContext.select(LINK),"Selecting the entire LINK table fetches all columns, which may retrieve unnecessary data and reduce query performance. Instead, explicitly select only the required columns: `dslContext.select(LINK.ID, LINK.URL, LINK.CHECKTIME, LINK.UPDATETIME)`."
DrBrother_notification-system,Implicit Columns,scrapper/src/main/java/ru/tinkoff/edu/java/scrapper/dao/jooq/JooqSubscriptionDAOImpl.java,40,40,return dslContext.select(SUBSCRIPTION),"Selecting the entire SUBSCRIPTION table fetches all columns, which may retrieve unnecessary data and reduce performance. Instead, explicitly select only the required columns: `dslContext.select(SUBSCRIPTION.CHAT_ID, SUBSCRIPTION.LINK_ID)`."
DrBrother_notification-system,ID Required,scrapper/src/main/java/ru/tinkoff/edu/java/scrapper/entity/jooq/tables/Chat.java,66,66,"public final TableField<ChatRecord, Long> ID = createField(DSL.name(""id""), SQLDataType.BIGINT.nullable(false), this, """");",The primary key column is generically named 'id' instead of a more descriptive name like 'chat_id'. This makes queries with joins harder to read and can cause ambiguity. Consider renaming the column to 'chat_id' to clearly identify which table it belongs to.
DrBrother_notification-system,ID Required,scrapper/src/main/java/ru/tinkoff/edu/java/scrapper/entity/jooq/tables/Link.java,70,70,"public final TableField<LinkRecord, Long> ID = createField(DSL.name(""id""), SQLDataType.BIGINT.nullable(false).identity(true), this, """");","The table uses a generic 'id' as the primary key name, and there's already a unique constraint on 'url' (LINK_URL_KEY) which could serve as a natural primary key since URLs are immutable identifiers for links. Consider using 'url' as the primary key or renaming 'id' to something more descriptive like 'link_id'."
DrBrother_notification-system,Fear of the Unknown,scrapper/src/main/java/ru/tinkoff/edu/java/scrapper/entity/jooq/tables/Link.java,80,80,"public final TableField<LinkRecord, LocalDateTime> UPDATETIME = createField(DSL.name(""updatetime""), SQLDataType.LOCALDATETIME(6).defaultValue(DSL.field(""now()"", SQLDataType.LOCALDATETIME)), this, """");","The 'updatetime' column has a default value but is implicitly NULLABLE (no .nullable(false) specified), which is inconsistent since a column with a default value that should always be populated shouldn't allow NULL. Add .nullable(false) to the column definition to enforce data integrity."
DrBrother_notification-system,Fear of the Unknown,scrapper/src/main/java/ru/tinkoff/edu/java/scrapper/entity/jooq/tables/Link.java,85,85,"public final TableField<LinkRecord, LocalDateTime> CHECKTIME = createField(DSL.name(""checktime""), SQLDataType.LOCALDATETIME(6).defaultValue(DSL.field(""now()"", SQLDataType.LOCALDATETIME)), this, """");","The 'checktime' column has a default value but is implicitly NULLABLE (no .nullable(false) specified), which is inconsistent since a column with a default value that should always be populated shouldn't allow NULL. Add .nullable(false) to the column definition to enforce data integrity."
