Project,Antipattern,File,Line from,Line to,Code fragment,Explanation
jsflzhong_cjSpringboot-demo,ID Required,jooq/src/main/java/com/cj/jooq/jooq/tables/CustDeviceInfo.java,61,61,"public final TableField<CustDeviceInfoRecord, Integer> ID = createField(""ID"", org.jooq.impl.SQLDataType.INTEGER.nullable(false).identity(true), this, """");","The primary key column is named just 'ID', which is a generic non-descriptive name that doesn't convey the table context. Consider renaming it to something more meaningful like 'cust_device_info_id' or 'device_info_id' to improve clarity when joining tables."
jsflzhong_cjSpringboot-demo,ID Required,jooq/src/main/java/com/cj/jooq/jooq/tables/CustDevicePushLog.java,61,61,"public final TableField<CustDevicePushLogRecord, Integer> ID = createField(""ID"", org.jooq.impl.SQLDataType.INTEGER.nullable(false).identity(true), this, """");",The primary key column is generically named 'ID' which doesn't convey any meaning about the entity it identifies. Consider renaming it to something more descriptive like 'push_log_id' or 'cust_device_push_log_id' to make the schema more self-documenting and avoid ambiguity in joins.
jsflzhong_cjSpringboot-demo,ID Required,jooq/src/main/java/com/cj/jooq/jooq/tables/UPermission.java,59,59,"public final TableField<UPermissionRecord, String> ID = createField(""id"", org.jooq.impl.SQLDataType.VARCHAR(32).nullable(false), this, """");","The primary key is named just 'id' which is a generic, non-descriptive name that doesn't convey the table context. Consider renaming it to 'permission_id' to make it more meaningful and to avoid ambiguity in queries with joins."
jsflzhong_cjSpringboot-demo,Keyless Entry,jooq/src/main/java/com/cj/jooq/jooq/tables/UPermission.java,79,79,"public final TableField<UPermissionRecord, String> PARENTID = createField(""parentId"", org.jooq.impl.SQLDataType.VARCHAR(32), this, ""父编号"");",The 'parentId' column appears to reference another permission record (self-referencing relationship) but lacks a foreign key constraint. Add a foreign key constraint referencing the 'u_permission' table's primary key to ensure referential integrity.
jsflzhong_cjSpringboot-demo,ID Required,jooq/src/main/java/com/cj/jooq/jooq/tables/URole.java,59,59,"public final TableField<URoleRecord, String> ID = createField(""id"", org.jooq.impl.SQLDataType.VARCHAR(32).nullable(false), this, """");",The primary key column is generically named 'id' instead of a more descriptive name like 'role_id'. Consider renaming the column to 'role_id' or using the natural key 'role' (which is described as a unique identifier) as the primary key instead.
jsflzhong_cjSpringboot-demo,ID Required,jooq/src/main/java/com/cj/jooq/jooq/tables/URolePermission.java,59,59,"public final TableField<URolePermissionRecord, String> ID = createField(""id"", org.jooq.impl.SQLDataType.VARCHAR(32).nullable(false), this, """");","The primary key is named 'id' which is a generic, non-descriptive name. This is a junction table linking roles and permissions, so a composite primary key on (RID, PID) would be more appropriate, or rename the column to something like 'role_permission_id'."
jsflzhong_cjSpringboot-demo,Keyless Entry,jooq/src/main/java/com/cj/jooq/jooq/tables/URolePermission.java,64,64,"public final TableField<URolePermissionRecord, String> RID = createField(""rid"", org.jooq.impl.SQLDataType.VARCHAR(32), this, ""角色ID"");","The RID column references a role (角色ID) but lacks a foreign key constraint to the u_role table, which has a primary key (KEY_U_ROLE_PRIMARY). Add a foreign key constraint referencing URole.ID to ensure referential integrity."
jsflzhong_cjSpringboot-demo,Keyless Entry,jooq/src/main/java/com/cj/jooq/jooq/tables/URolePermission.java,69,69,"public final TableField<URolePermissionRecord, String> PID = createField(""pid"", org.jooq.impl.SQLDataType.VARCHAR(32), this, ""权限ID"");","The PID column references a permission (权限ID) but lacks a foreign key constraint to the u_permission table, which has a primary key (KEY_U_PERMISSION_PRIMARY). Add a foreign key constraint referencing UPermission.ID to ensure referential integrity."
jsflzhong_cjSpringboot-demo,ID Required,jooq/src/main/java/com/cj/jooq/jooq/tables/UserT.java,59,59,"public final TableField<UserTRecord, Integer> ID = createField(""id"", org.jooq.impl.SQLDataType.INTEGER.nullable(false), this, """");",The primary key column is named generically as 'id' rather than a more descriptive name like 'user_id'. Consider renaming the column to 'user_id' or 'user_t_id' to make it self-documenting and avoid ambiguity in queries with joins.
jsflzhong_cjSpringboot-demo,ID Required,jooq/src/main/java/com/cj/jooq/jooq/tables/UUser.java,60,60,"public final TableField<UUserRecord, String> ID = createField(""id"", org.jooq.impl.SQLDataType.VARCHAR(32).nullable(false), this, """");","The primary key column is named just 'id', which is a generic name that doesn't convey any meaning about the table it belongs to. Consider renaming it to something more descriptive like 'user_id' to make queries with joins more readable and self-documenting."
jsflzhong_cjSpringboot-demo,ID Required,jooq/src/main/java/com/cj/jooq/jooq/tables/UUserRole.java,59,59,"public final TableField<UUserRoleRecord, String> ID = createField(""id"", org.jooq.impl.SQLDataType.VARCHAR(32).nullable(false), this, """");","This junction table (u_user_role) has a synthetic primary key named 'id' when the natural composite key of (uid, rid) would be more appropriate. Consider using a composite primary key on the UID and RID columns instead of the synthetic ID column."
jsflzhong_cjSpringboot-demo,Keyless Entry,jooq/src/main/java/com/cj/jooq/jooq/tables/UUserRole.java,64,64,"public final TableField<UUserRoleRecord, String> UID = createField(""uid"", org.jooq.impl.SQLDataType.VARCHAR(32), this, ""用户ID"");","The UID column references users (u_user table) but lacks a foreign key constraint, which could lead to orphaned records or invalid user references. Add a foreign key constraint referencing the KEY_U_USER_PRIMARY key."
jsflzhong_cjSpringboot-demo,Keyless Entry,jooq/src/main/java/com/cj/jooq/jooq/tables/UUserRole.java,69,69,"public final TableField<UUserRoleRecord, String> RID = createField(""rid"", org.jooq.impl.SQLDataType.VARCHAR(32), this, ""角色ID"");","The RID column references roles (u_role table) but lacks a foreign key constraint, which could lead to orphaned records or invalid role references. Add a foreign key constraint referencing the KEY_U_ROLE_PRIMARY key."
jsflzhong_cjSpringboot-demo,Implicit Columns,jooq/src/main/java/com/cj/jooq/service/base/AbstractJooqFactory.java,44,44,return dsl.selectFrom(table()).fetchInto(type());,"Using selectFrom(table()) fetches all columns from the table, which can retrieve unnecessary data and impact performance. Consider explicitly selecting only the required columns using dsl.select(field1, field2, ...).from(table())."
jsflzhong_cjSpringboot-demo,Implicit Columns,jooq/src/main/java/com/cj/jooq/service/base/AbstractJooqFactory.java,57,57,return dsl.selectFrom(table()).where(field.eq(value)).fetchInto(type());,"Using selectFrom(table()) fetches all columns from the table, which may include unnecessary data. Consider explicitly selecting only the columns needed for the entity mapping."
jsflzhong_cjSpringboot-demo,Implicit Columns,jooq/src/main/java/com/cj/jooq/service/base/AbstractJooqFactory.java,66,66,return dsl.selectFrom(table()).where(field.eq(value)).fetchOptionalInto(type());,Using selectFrom(table()) retrieves all columns from the table regardless of which fields are actually needed. Consider using dsl.select(...).from(table()) with explicit column selection.
jsflzhong_cjSpringboot-demo,Implicit Columns,jooq/src/main/java/com/cj/jooq/service/base/AbstractJooqFactory.java,277,277,return dsl.selectFrom(table()).where(trueCondition());,"Using selectFrom(table()) fetches all columns from the table, which can be inefficient. Consider explicitly specifying the required columns in the select clause."
jsflzhong_cjSpringboot-demo,Implicit Columns,jooq/src/main/java/com/cj/jooq/service/base/AbstractJooqFactory.java,279,279,return dsl.selectFrom(table()).where(condition);,Using selectFrom(table()) retrieves all columns from the table. Consider explicitly selecting only the columns that are needed for the query results.
jsflzhong_cjSpringboot-demo,Implicit Columns,jooq/src/main/java/com/cj/jooq/service/impl/TestJooqServiceImpl.java,32,32,.select(),"Using select() without specifying columns fetches all columns from the U_USER table, which can retrieve unnecessary data and impact performance. Specify only the required columns explicitly, e.g., .select(U_USER.ID, U_USER.USERNAME, ...)."
