Project,Antipattern,File,Line from,Line to,Code fragment,Explanation
Maczi01_sockets,ID Required,src/main/java/db/tables/Messages.java,57,57,"public final TableField<MessagesRecord, Integer> ID = createField(DSL.name(""id""), SQLDataType.INTEGER.nullable(false).identity(true), this, """");",The primary key is named just 'id' which is a generic name that doesn't convey meaning about the table it belongs to. Consider renaming it to 'message_id' to make it more descriptive and avoid ambiguity in queries with joins.
Maczi01_sockets,ID Required,src/main/java/db/tables/Users.java,52,52,"public final TableField<UsersRecord, Integer> ID = createField(DSL.name(""id""), SQLDataType.INTEGER.nullable(false).identity(true), this, """");",The primary key is named just 'id' which is a generic name that doesn't convey meaning about the entity. Consider renaming it to 'user_id' to make it more descriptive and self-documenting when used in foreign key relationships.
Maczi01_sockets,31 Flavors,src/main/java/db/tables/Users.java,67,67,"public final TableField<UsersRecord, UsersRole> ROLE = createField(DSL.name(""role""), SQLDataType.VARCHAR(5).nullable(false).asEnumDataType(db.enums.UsersRole.class), this, """");","The 'role' column uses an ENUM type (UsersRole) to restrict allowed values, which makes adding or removing roles difficult without schema changes. Consider creating a separate 'roles' lookup table and referencing it with a foreign key for better flexibility."
Maczi01_sockets,Implicit Columns,src/main/java/message/MessageService.java,50,50,long numberOfMessages = ctx.select(MESSAGES.ID),"The query selects MESSAGES.ID only to count records, which is inefficient. Use `ctx.fetchCount(MESSAGES, MESSAGES.RECEIVER_ID.eq(receiverId))` instead to let the database perform the count directly."
Maczi01_sockets,Implicit Columns,src/main/java/user/UserService.java,29,29,return create.selectFrom(USERS),"Using selectFrom(USERS) fetches all columns from the USERS table, which may retrieve unnecessary data. Consider explicitly selecting only the columns needed for the User class, e.g., create.select(USERS.USERNAME, USERS.ROLE, USERS.PASSWORD).from(USERS)."
Maczi01_sockets,Implicit Columns,src/main/java/user/UserService.java,35,35,List<User> userList = create.selectFrom(USERS),"Using selectFrom(USERS) fetches all columns from the USERS table when only specific fields may be needed. Consider explicitly selecting only the required columns, e.g., create.select(USERS.USERNAME, USERS.ROLE).from(USERS)."
Maczi01_sockets,Implicit Columns,src/main/java/user/UserService.java,104,104,User foundUser = create.selectFrom(USERS),"Using selectFrom(USERS) fetches all columns from the USERS table, but only USERNAME, ROLE, and PASSWORD are used. Consider explicitly selecting only these columns: create.select(USERS.USERNAME, USERS.ROLE, USERS.PASSWORD).from(USERS)."
