Project,Antipattern,File,Line from,Line to,Code fragment,Explanation
ojhughes_concourse-http-lock-resource,ID Required,src/main/java/io/pivotal/spring/cloud/services/resourcelock/db/generated/tables/EnvironmentMetaSchema.java,66,66,"public final TableField<EnvironmentMetaSchemaRecord, Integer> ID = createField(""id"", org.jooq.impl.SQLDataType.INTEGER.nullable(false).defaultValue(org.jooq.impl.DSL.field(""1"", org.jooq.impl.SQLDataType.INTEGER)), this, """");","The primary key column is named just 'id', which is a generic name that doesn't convey any meaning about the table it belongs to. Consider renaming it to something more descriptive like 'environment_meta_schema_id' to make it self-documenting and avoid ambiguity in joins."
ojhughes_concourse-http-lock-resource,ID Required,src/main/java/io/pivotal/spring/cloud/services/resourcelock/db/generated/tables/Environments.java,64,64,"public final TableField<EnvironmentsRecord, Integer> ID = createField(""id"", org.jooq.impl.SQLDataType.INTEGER.nullable(false).defaultValue(org.jooq.impl.DSL.field(""nextval('environments_id_seq'::regclass)"", org.jooq.impl.SQLDataType.INTEGER)), this, """");","The primary key column is named just 'id', which is a generic name that doesn't convey meaning about the table it belongs to. Consider renaming it to 'environment_id' to make it more descriptive and to avoid ambiguity in queries with joins."
ojhughes_concourse-http-lock-resource,Keyless Entry,src/main/java/io/pivotal/spring/cloud/services/resourcelock/db/generated/tables/Environments.java,79,79,"public final TableField<EnvironmentsRecord, Integer> LOCK_ID = createField(""lock_id"", org.jooq.impl.SQLDataType.INTEGER, this, """");","The 'lock_id' column appears to reference the 'locks' table but has no foreign key constraint defined, which could lead to orphaned records or invalid references. Add a foreign key constraint referencing 'Keys.LOCKS_PKEY' to ensure referential integrity."
ojhughes_concourse-http-lock-resource,ID Required,src/main/java/io/pivotal/spring/cloud/services/resourcelock/db/generated/tables/Locks.java,62,62,"public final TableField<LocksRecord, Integer> ID = createField(""id"", org.jooq.impl.SQLDataType.INTEGER.nullable(false).defaultValue(org.jooq.impl.DSL.field(""nextval('locks_id_seq'::regclass)"", org.jooq.impl.SQLDataType.INTEGER)), this, """");","The primary key is named just 'id' which is a generic, non-descriptive name that doesn't convey meaning about the table it belongs to. Consider renaming it to 'lock_id' to make it more descriptive and to avoid ambiguity in queries with joins."
ojhughes_concourse-http-lock-resource,Keyless Entry,src/main/java/io/pivotal/spring/cloud/services/resourcelock/db/generated/tables/Locks.java,77,77,"public final TableField<LocksRecord, Integer> ENVIRONMENT_ID = createField(""environment_id"", org.jooq.impl.SQLDataType.INTEGER.nullable(false), this, """");","The column 'environment_id' appears to reference the 'environments' table but lacks a foreign key constraint, which could lead to orphaned records or invalid references. Add a foreign key constraint referencing ENVIRONMENTS_PKEY to ensure referential integrity."
ojhughes_concourse-http-lock-resource,ID Required,src/main/java/io/pivotal/spring/cloud/services/resourcelock/db/generated/tables/Pools.java,61,61,"public final TableField<PoolsRecord, Integer> ID = createField(""id"", org.jooq.impl.SQLDataType.INTEGER.nullable(false).defaultValue(org.jooq.impl.DSL.field(""nextval('pools_id_seq'::regclass)"", org.jooq.impl.SQLDataType.INTEGER)), this, """");","The primary key is named just 'id', which is a generic name that doesn't convey meaning about the table it belongs to. Consider renaming it to 'pool_id' to make it more descriptive and to avoid ambiguity in queries with joins."
ojhughes_concourse-http-lock-resource,Implicit Columns,src/main/java/io/pivotal/spring/cloud/services/resourcelock/service/PoolService.java,72,72,return dbContext.selectFrom(Pools.POOLS),"Using `selectFrom(Pools.POOLS)` fetches all columns from the POOLS table, which may retrieve unnecessary data. Consider using `select()` with only the specific columns needed, such as `select(Pools.POOLS.ID, Pools.POOLS.NAME)`."
ojhughes_concourse-http-lock-resource,Implicit Columns,src/test/java/io/pivotal/spring/cloud/services/resourcelock/service/PoolServiceIntegrationTest.java,112,112,PoolsRecord record = dbContext.selectFrom(Pools.POOLS).where(Pools.POOLS.NAME.eq(expectedPoolName)).fetchOne();,"Using `selectFrom(Pools.POOLS)` fetches all columns from the POOLS table into a PoolsRecord, even though only the NAME column is used. Consider selecting only the required columns explicitly, e.g., `dbContext.select(Pools.POOLS.NAME).from(Pools.POOLS)...`."
