Project,Antipattern,File,Line from,Line to,Code fragment,Explanation
pratyush05_trade-app,ID Required,src/generated/jooq/org/jooq/generated/tables/Stock.java,61,61,"public final TableField<StockRecord, Integer> ID = createField(""id"", org.jooq.impl.SQLDataType.INTEGER.nullable(false), this, """");",The primary key is named generically 'id' instead of a more descriptive name like 'stock_id'. Consider renaming the primary key to 'stock_id' to make it more meaningful and to avoid ambiguity when joining tables.
pratyush05_trade-app,Rounding Errors,src/generated/jooq/org/jooq/generated/tables/Stock.java,76,76,"public final TableField<StockRecord, Double> PRICE = createField(""price"", org.jooq.impl.SQLDataType.DOUBLE, this, """");","The 'price' column uses DOUBLE which can cause rounding errors for financial values. Stock prices require exact precision, so use DECIMAL or NUMERIC instead (e.g., DECIMAL(19,4)) to avoid floating-point inaccuracies in calculations."
pratyush05_trade-app,ID Required,src/generated/jooq/org/jooq/generated/tables/Trade.java,61,61,"public final TableField<TradeRecord, Integer> ID = createField(""id"", org.jooq.impl.SQLDataType.INTEGER.nullable(false), this, """");",The primary key column is generically named 'id' instead of a more descriptive name like 'trade_id'. Consider renaming the column to 'trade_id' to make it self-documenting and avoid ambiguity in queries with joins.
pratyush05_trade-app,Rounding Errors,src/generated/jooq/org/jooq/generated/tables/Trade.java,71,71,"public final TableField<TradeRecord, Double> PRICE = createField(""price"", org.jooq.impl.SQLDataType.DOUBLE, this, """");","The 'price' column uses DOUBLE which can cause rounding errors in financial calculations. Use DECIMAL or NUMERIC with appropriate precision and scale (e.g., DECIMAL(19,4)) to ensure accurate monetary values."
pratyush05_trade-app,ID Required,src/generated/jooq/org/jooq/generated/tables/Trader.java,61,61,"public final TableField<TraderRecord, Integer> ID = createField(""id"", org.jooq.impl.SQLDataType.INTEGER.nullable(false), this, """");",The primary key column is generically named 'id' instead of a more descriptive name like 'trader_id'. Consider renaming the column to 'trader_id' to make it self-documenting and avoid ambiguity when joining tables.
