Project,Antipattern,File,Line from,Line to,Code fragment,Explanation
rench_scio,ID Required,scio-cloud-jooq/src/main/java/com/scio/cloud/jooq/domain/public_/tables/UserInfo.java,63,63,"public final TableField<UserInfoRecord, Long> ID = createField(""ID"", org.jooq.impl.SQLDataType.BIGINT.nullable(false).identity(true), this, """");","The primary key is named just 'ID' which is a generic, non-descriptive name. Additionally, there's already a unique constraint on USERNAME which could serve as a natural key. Consider renaming the primary key to 'user_info_id' for clarity, or evaluate if USERNAME could be used as the primary key instead."
rench_scio,Implicit Columns,scio-cloud-jooq/src/main/java/com/scio/cloud/jooq/service/UserInfoServiceImpl.java,43,43,userinfo.fetchOneById(id),The DAO's fetchOneById method fetches all columns from the USER_INFO table. Consider using a DSLContext query that explicitly selects only the required columns.
rench_scio,Implicit Columns,scio-cloud-jooq/src/main/java/com/scio/cloud/jooq/service/UserInfoServiceImpl.java,51,51,userinfo.fetchOneByUsername(username),The DAO's fetchOneByUsername method fetches all columns from the USER_INFO table. Consider using a DSLContext query that explicitly selects only the required columns.
rench_scio,Implicit Columns,scio-cloud-jooq/src/main/java/com/scio/cloud/jooq/service/UserInfoServiceImpl.java,72,72,dsl.selectFrom(USER_INFO),Using selectFrom fetches all columns from the USER_INFO table. Consider using dsl.select() with explicit column names to fetch only the columns needed.
rench_scio,Implicit Columns,scio-cloud-jooq/src/main/java/com/scio/cloud/jooq/service/UserInfoServiceImpl.java,86,86,dsl.selectFrom(USER_INFO),Using selectFrom fetches all columns from the USER_INFO table. Consider using dsl.select() with explicit column names to fetch only the columns needed.
