Project,Antipattern,File,Line from,Line to,Code fragment,Explanation
RuslanAndrianov_Backend-Java-Tinkoff-Spring-2024,ID Required,scrapper/src/main/java/edu/java/scrapper/domain/jooq/tables/Links.java,65,65,"public final TableField<LinksRecord, Long> LINK_ID = createField(DSL.name(""LINK_ID""), SQLDataType.BIGINT.nullable(false), this, """");",The table has a synthetic primary key (LINK_ID) even though the URL column could serve as a natural key since URLs are unique and immutable by nature. Consider using URL as the primary key or renaming LINK_ID to something more descriptive that reflects the domain.
RuslanAndrianov_Backend-Java-Tinkoff-Spring-2024,Implicit Columns,scrapper/src/main/java/edu/java/scrapper/domain/repository/jooq/JooqChatsRepository.java,61,61,.selectFrom(CHATS),"Using selectFrom(CHATS) fetches all columns from the CHATS table, even though only CHAT_ID is used. Replace with .select(CHATS.CHAT_ID).from(CHATS) to explicitly select only the needed column."
RuslanAndrianov_Backend-Java-Tinkoff-Spring-2024,Implicit Columns,scrapper/src/main/java/edu/java/scrapper/domain/repository/jooq/JooqChatsRepository.java,82,82,.selectFrom(CHATS),Using selectFrom(CHATS) fetches all columns from the CHATS table when only CHAT_ID is needed. Replace with .select(CHATS.CHAT_ID).from(CHATS) to explicitly select only the required column.
RuslanAndrianov_Backend-Java-Tinkoff-Spring-2024,Implicit Columns,scrapper/src/main/java/edu/java/scrapper/domain/repository/jooq/JooqChatsToLinksRepository.java,93,93,.selectFrom(CHATS_TO_LINKS),"Using selectFrom() fetches all columns from the CHATS_TO_LINKS table, but only the link_id is needed. Replace with an explicit select: .select(CHATS_TO_LINKS.LINK_ID).from(CHATS_TO_LINKS)."
RuslanAndrianov_Backend-Java-Tinkoff-Spring-2024,Implicit Columns,scrapper/src/main/java/edu/java/scrapper/domain/repository/jooq/JooqChatsToLinksRepository.java,105,105,.selectFrom(CHATS_TO_LINKS),"Using selectFrom() fetches all columns from the CHATS_TO_LINKS table, but only the chat_id is needed. Replace with an explicit select: .select(CHATS_TO_LINKS.CHAT_ID).from(CHATS_TO_LINKS)."
RuslanAndrianov_Backend-Java-Tinkoff-Spring-2024,Implicit Columns,scrapper/src/main/java/edu/java/scrapper/domain/repository/jooq/JooqLinksRepository.java,71,71,.selectFrom(LINKS),"Using selectFrom(LINKS) fetches all columns from the LINKS table, which can retrieve unnecessary data and impact performance. Consider explicitly selecting only the required columns using .select(LINKS.LINK_ID, LINKS.URL, ...).from(LINKS)."
RuslanAndrianov_Backend-Java-Tinkoff-Spring-2024,Implicit Columns,scrapper/src/main/java/edu/java/scrapper/domain/repository/jooq/JooqLinksRepository.java,98,98,.selectFrom(LINKS),"Using selectFrom(LINKS) fetches all columns from the LINKS table, which can retrieve unnecessary data and impact performance. Consider explicitly selecting only the required columns using .select(LINKS.LINK_ID, LINKS.URL, ...).from(LINKS)."
RuslanAndrianov_Backend-Java-Tinkoff-Spring-2024,Implicit Columns,scrapper/src/main/java/edu/java/scrapper/domain/repository/jooq/JooqLinksRepository.java,123,123,.selectFrom(LINKS),"Using selectFrom(LINKS) fetches all columns from the LINKS table, which can retrieve unnecessary data and impact performance. Consider explicitly selecting only the required columns using .select(LINKS.LINK_ID, LINKS.URL, ...).from(LINKS)."
RuslanAndrianov_Backend-Java-Tinkoff-Spring-2024,Implicit Columns,scrapper/src/main/java/edu/java/scrapper/domain/repository/jooq/JooqLinksRepository.java,141,141,"String sql = ""SELECT * FROM links WHERE (last_checked ""","Using SELECT * fetches all columns from the links table, which can retrieve unnecessary data and impact performance. Consider explicitly listing only the required columns in the SELECT clause."
