Project,Antipattern,File,Line from,Line to,Code fragment,Explanation
stukenvitalii_TinkoffBot,ID Required,scrapper/src/main/java/edu/java/domain/jooq/tables/Chat.java,63,64,"public final TableField<ChatRecord, Long> ID =
    createField(DSL.name(""ID""), SQLDataType.BIGINT.nullable(false).identity(true), this, """");",The table uses a generic 'ID' column as the primary key instead of a more meaningful name. Consider renaming the primary key to something more descriptive like 'chat_pk' or using the natural key 'CHAT_ID' as the primary key if it uniquely identifies records.
stukenvitalii_TinkoffBot,ID Required,scrapper/src/main/java/edu/java/domain/jooq/tables/Link.java,64,65,"public final TableField<LinkRecord, Long> ID =
    createField(DSL.name(""ID""), SQLDataType.BIGINT.nullable(false).identity(true), this, """");",The primary key is named just 'ID' which is generic and doesn't convey meaning about the table it belongs to. Consider renaming it to 'link_id' to make it more descriptive and avoid ambiguity in JOIN queries.
stukenvitalii_TinkoffBot,Keyless Entry,scrapper/src/main/java/edu/java/domain/jooq/tables/Link.java,76,77,"public final TableField<LinkRecord, Long> CHAT_ID =
    createField(DSL.name(""CHAT_ID""), SQLDataType.BIGINT.nullable(false), this, """");","The CHAT_ID column appears to reference the Chat table but lacks a foreign key constraint, which could lead to orphaned records and data integrity issues. Add a foreign key constraint referencing the Chat table's primary key (PK_CHAT)."
stukenvitalii_TinkoffBot,ID Required,scrapper/src/main/java/edu/java/domain/jooq/tables/SofLinkProperties.java,63,64,"public final TableField<SofLinkPropertiesRecord, Long> ID =
    createField(DSL.name(""ID""), SQLDataType.BIGINT.nullable(false).identity(true), this, """");","The primary key is named just 'ID' which is a generic, non-descriptive name. Consider renaming it to something more meaningful like 'sof_link_properties_id' or using the natural key 'LINK_ID' as the primary key since it appears to uniquely identify the link properties."
stukenvitalii_TinkoffBot,Keyless Entry,scrapper/src/main/java/edu/java/domain/jooq/tables/SofLinkProperties.java,69,70,"public final TableField<SofLinkPropertiesRecord, Long> LINK_ID =
    createField(DSL.name(""LINK_ID""), SQLDataType.BIGINT.nullable(false), this, """");",The LINK_ID column appears to reference the Link table but has no foreign key constraint defined. Add a foreign key constraint referencing Keys.PK_LINK to ensure referential integrity and prevent orphaned records.
stukenvitalii_TinkoffBot,Implicit Columns,scrapper/src/main/java/edu/java/repository/jooq/JooqChatRepository.java,27,27,return dslContext.selectFrom(CHAT).fetchInto(Chat.class);,"Using selectFrom(CHAT) fetches all columns from the CHAT table, which can retrieve unnecessary data and impact performance. Consider explicitly selecting only the required columns using select(CHAT.ID, CHAT.CHAT_ID).from(CHAT)."
stukenvitalii_TinkoffBot,Implicit Columns,scrapper/src/main/java/edu/java/repository/jooq/JooqLinkRepository.java,36,36,return dslContext.selectFrom(LINK).fetchInto(Link.class);,"Using `selectFrom(LINK)` fetches all columns from the LINK table, which can retrieve unnecessary data and impact performance. Consider explicitly selecting only the required columns using `select(LINK.ID, LINK.URL, ...)` instead."
stukenvitalii_TinkoffBot,Implicit Columns,scrapper/src/main/java/edu/java/repository/jooq/JooqLinkRepository.java,46,46,"return dslContext.resultQuery(""select * from LINK where EXTRACT(SECOND FROM (now() - last_check_time )) > 30"")","Using `SELECT *` fetches all columns from the LINK table, which retrieves unnecessary data and reduces query maintainability. Replace with an explicit column list like `SELECT id, url, chat_id, ...` specifying only the needed columns."
stukenvitalii_TinkoffBot,Implicit Columns,scrapper/src/main/java/edu/java/repository/jooq/JooqLinkRepository.java,59,59,return dslContext.selectFrom(SOF_LINK_PROPERTIES),"Using `selectFrom(SOF_LINK_PROPERTIES)` fetches all columns from the SOF_LINK_PROPERTIES table, which may retrieve more data than needed. Consider explicitly selecting only the required columns using `select(SOF_LINK_PROPERTIES.LINK_ID, ...)` instead."
