Project,Antipattern,File,Line from,Line to,Code fragment,Explanation
TivM_Tinkoff-Project,ID Required,project/scrapper/src/main/java/ru/tinkoff/edu/java/scrapper/entity/jooq/tables/Link.java,55,56,"public final TableField<LinkRecord, Long> ID =
    createField(DSL.name(""ID""), SQLDataType.BIGINT.nullable(false).identity(true), this, """");",The table uses a generic 'ID' column as primary key while having a unique constraint on 'URL' which could serve as a natural key. Consider using 'URL' as the primary key or renaming the synthetic key to something more descriptive like 'link_id'.
TivM_Tinkoff-Project,ID Required,project/scrapper/src/main/java/ru/tinkoff/edu/java/scrapper/entity/jooq/tables/TgChat.java,52,53,"public final TableField<TgChatRecord, Long> ID =
    createField(DSL.name(""ID""), SQLDataType.BIGINT.nullable(false), this, """");","The primary key column is generically named 'ID' instead of a more descriptive name like 'tg_chat_id' or 'chat_id'. Consider renaming the column to something more meaningful that identifies what entity it represents, such as 'tg_chat_id'."
TivM_Tinkoff-Project,Implicit Columns,project/scrapper/src/main/java/ru/tinkoff/edu/java/scrapper/repository/jooq/JooqLinkRepository.java,20,20,.returningResult(LINK.fields()),"Using `LINK.fields()` returns all columns from the LINK table, which is an implicit column selection. Explicitly list only the columns needed (e.g., `LINK.ID, LINK.URL, LINK.LAST_CHECK_TIME, LINK.UPDATED_AT, LINK.UPDATES_COUNT`) instead of using `fields()`."
