Project,Antipattern,File,Line from,Line to,Code fragment,Explanation
voidframework_voidframework,ID Required,voidframework-persistence-jooq/src/test/java/dev/voidframework/persistence/jooq/model/tables/UnitTestManagedEntity.java,55,55,"public final TableField<UnitTestManagedEntityRecord, String> ID = createField(DSL.name(""ID""), SQLDataType.VARCHAR(255).nullable(false), this, """");","The primary key column is named just 'ID', which is a generic name that doesn't convey the entity it identifies. Consider renaming it to something more descriptive like 'unit_test_managed_entity_id' or 'managed_entity_id' to improve clarity and avoid ambiguity in joins."
voidframework_voidframework,Implicit Columns,voidframework-persistence-jooq/src/test/java/dev/voidframework/persistence/jooq/PersistenceJooqTest.java,140,140,.select(),"Using select() without specifying columns fetches all columns from UNIT_TEST_MANAGED_ENTITY table, which can retrieve unnecessary data and cause maintenance issues if the table schema changes. Specify only the required columns explicitly, e.g., .select(Tables.UNIT_TEST_MANAGED_ENTITY.ID)."
voidframework_voidframework,Implicit Columns,voidframework-persistence-jooq/src/test/java/dev/voidframework/persistence/jooq/TransactionalTest.java,90,90,.select(),"Using select() without specifying columns fetches all columns from UNIT_TEST_MANAGED_ENTITY, which is inefficient and can break if the table schema changes. Specify only the required columns explicitly, e.g., .select(Tables.UNIT_TEST_MANAGED_ENTITY.ID)."
voidframework_voidframework,Implicit Columns,voidframework-persistence-jooq/src/test/java/dev/voidframework/persistence/jooq/TransactionalTest.java,112,112,.select(),"Using select() without specifying columns fetches all columns from UNIT_TEST_MANAGED_ENTITY, which retrieves unnecessary data and couples the code to the table schema. Specify only the required columns explicitly, e.g., .select(Tables.UNIT_TEST_MANAGED_ENTITY.ID)."
voidframework_voidframework,Implicit Columns,voidframework-persistence-jooq/src/test/java/dev/voidframework/persistence/jooq/TransactionalTest.java,133,133,.select(),"Using select() without specifying columns fetches all columns from UNIT_TEST_MANAGED_ENTITY, which is wasteful and fragile. Specify only the required columns explicitly, e.g., .select(Tables.UNIT_TEST_MANAGED_ENTITY.ID)."
