Project,Antipattern,File,Line from,Line to,Code fragment,Explanation
xinxiamu_mu-spring-boot-sample,Beware of the Unknown,jOOQ-jpa-example/src/main/java/org/jooq/example/jpa/jooq/tables/Actor.java,66,66,"public final TableField<ActorRecord, String> FIRSTNAME = createField(""FIRSTNAME"", org.jooq.impl.SQLDataType.VARCHAR(255), this, """");",The FIRSTNAME column is nullable but likely should always have a value for an actor. Consider adding a NOT NULL constraint or providing a meaningful default value if the field is truly optional.
xinxiamu_mu-spring-boot-sample,Beware of the Unknown,jOOQ-jpa-example/src/main/java/org/jooq/example/jpa/jooq/tables/Actor.java,71,71,"public final TableField<ActorRecord, String> LASTNAME = createField(""LASTNAME"", org.jooq.impl.SQLDataType.VARCHAR(255), this, """");",The LASTNAME column is nullable but an actor's last name is typically required data. Consider adding a NOT NULL constraint to enforce data integrity.
xinxiamu_mu-spring-boot-sample,Implicit Columns,springboot-jooq/src/main/java/com/example/ymu/dao/impl/BookDaoImpl.java,46,46,Result<BookRecord> bookRecord = jooqDsl.selectFrom(BOOK).where(BOOK.ID.equals(bookId)).fetch();,"Using `selectFrom(BOOK)` fetches all columns from the BOOK table, but only the book name appears to be needed based on the method name. Replace with an explicit column selection like `select(BOOK.BOOK_NAME).from(BOOK)`."
xinxiamu_mu-spring-boot-sample,Implicit Columns,springboot-jooq/src/main/java/com/example/ymu/dao/impl/SchoolDaoImpl.java,41,41,Result<Record> a = jooqDsl.select().from(School.SCHOOL).fetch();,"Using `select()` without specifying columns fetches all columns from the SCHOOL table, which can retrieve unnecessary data and hurt performance. Specify only the required columns, e.g., `select(School.SCHOOL.NAME)` since only the name is used."
xinxiamu_mu-spring-boot-sample,Implicit Columns,springboot-jooq/src/main/java/com/example/ymu/dao/impl/SchoolDaoImpl.java,48,48,Result<Record> result = jooqDsl.select().from(School.SCHOOL).crossJoin(Teacher.TEACHER).where(School.SCHOOL.ID.eq(Teacher.TEACHER.SCHOOL_ID)).fetch();,"Using `select()` without specifying columns fetches all columns from both SCHOOL and TEACHER tables, which retrieves unnecessary data. Since only the result count is used, consider using `fetchCount()` or specify only the columns you need."
xinxiamu_mu-spring-boot-sample,Implicit Columns,springboot-jooq/src/test/java/com/example/ymu/DaoTest.java,80,80,Result<Record> a = schoolDao.getJooq().select().from(SCHOOL).fetch();,"Using `select()` without specifying columns fetches all columns from the SCHOOL table, which can retrieve unnecessary data and hurt performance. Specify only the required columns explicitly, e.g., `select(SCHOOL.NAME, SCHOOL.ADDR)`."
