Project,Antipattern,File,Line from,Line to,Code fragment,Explanation
zhuyb0614_graph-batis,Keyless Entry,graph-batis-example/graph-batis-example-jooq/src/main/java/org/zhuyb/graphbatis/jooq/tables/TStudent.java,45,45,"public final TableField<TStudentRecord, Integer> ROOM_ID = createField(DSL.name(""room_id""), org.jooq.impl.SQLDataType.INTEGER, this, """");","The ROOM_ID column appears to reference the t_room table (which has KEY_T_ROOM_PRIMARY on ROOM_ID), but no foreign key constraint is defined. Add a foreign key constraint from t_student.room_id to t_room.room_id to ensure referential integrity."
zhuyb0614_graph-batis,Keyless Entry,graph-batis-example/graph-batis-example-jooq/src/main/java/org/zhuyb/graphbatis/jooq/tables/TTeacher.java,49,49,"public final TableField<TTeacherRecord, Integer> SUBJECT_ID = createField(DSL.name(""subject_id""), org.jooq.impl.SQLDataType.INTEGER, this, """");","The column 'subject_id' appears to reference the 't_subject' table but lacks a foreign key constraint, which could lead to orphaned records or invalid references. Add a foreign key constraint referencing the primary key 'KEY_T_SUBJECT_PRIMARY' on the 't_subject' table."
zhuyb0614_graph-batis,Keyless Entry,graph-batis-example/graph-batis-example-jooq/src/main/java/org/zhuyb/graphbatis/jooq/tables/TTeacherRoom.java,45,45,"public final TableField<TTeacherRoomRecord, Integer> TEACHER_ID = createField(DSL.name(""teacher_id""), org.jooq.impl.SQLDataType.INTEGER, this, """");","The TEACHER_ID column appears to reference the t_teacher table but lacks a foreign key constraint, which could lead to orphaned records or referential integrity issues. Add a foreign key constraint referencing KEY_T_TEACHER_PRIMARY to ensure data consistency."
zhuyb0614_graph-batis,Keyless Entry,graph-batis-example/graph-batis-example-jooq/src/main/java/org/zhuyb/graphbatis/jooq/tables/TTeacherRoom.java,49,49,"public final TableField<TTeacherRoomRecord, Integer> ROOM_ID = createField(DSL.name(""room_id""), org.jooq.impl.SQLDataType.INTEGER, this, """");","The ROOM_ID column appears to reference the t_room table but lacks a foreign key constraint, which could allow invalid room references to be inserted. Add a foreign key constraint referencing KEY_T_ROOM_PRIMARY to maintain referential integrity."
zhuyb0614_graph-batis,Beware of the Unknown,graph-batis-example/graph-batis-example-jooq/src/main/java/org/zhuyb/graphbatis/jooq/tables/TTeacherRoom.java,45,45,"public final TableField<TTeacherRoomRecord, Integer> TEACHER_ID = createField(DSL.name(""teacher_id""), org.jooq.impl.SQLDataType.INTEGER, this, """");",The TEACHER_ID column is nullable in a junction table where it should logically always have a value to establish the relationship between teacher and room. Mark this column as NOT NULL to prevent incomplete relationship records.
zhuyb0614_graph-batis,Beware of the Unknown,graph-batis-example/graph-batis-example-jooq/src/main/java/org/zhuyb/graphbatis/jooq/tables/TTeacherRoom.java,49,49,"public final TableField<TTeacherRoomRecord, Integer> ROOM_ID = createField(DSL.name(""room_id""), org.jooq.impl.SQLDataType.INTEGER, this, """");",The ROOM_ID column is nullable in a junction table where it should logically always have a value to establish the relationship between teacher and room. Mark this column as NOT NULL to prevent incomplete relationship records.
